{
  "schema_version": "1.0.0",
  "run_id": "editorial-score-20260729",
  "date": "2026-07-29",
  "generated_at": "2026-07-29T09:00:00+08:00",
  "weights_version": "1.0.0",
  "scores": [
    {
      "candidate_id": "candidate-20260729-001",
      "primary_category": "ai_technology",
      "novelty_kind": "new_theme",
      "components": {
        "authority": 98,
        "freshness": 100,
        "relevance": 96,
        "evidence_quality": 98,
        "impact": 95,
        "novelty": 90,
        "content_value": 96,
        "product_value": 92,
        "risk_penalty": 0
      },
      "final_score": 96,
      "eligibility": "eligible",
      "recommended_action": "select_new",
      "reasons": [
        "综合得分达到新增事实准入线",
        "证据声明 1 条，其中直接证据 1 条"
      ],
      "rank": 1
    },
    {
      "candidate_id": "candidate-20260729-002",
      "primary_category": "developer_tools",
      "novelty_kind": "new_angle",
      "components": {
        "authority": 96,
        "freshness": 98,
        "relevance": 94,
        "evidence_quality": 96,
        "impact": 92,
        "novelty": 86,
        "content_value": 93,
        "product_value": 90,
        "risk_penalty": 0
      },
      "final_score": 93,
      "eligibility": "eligible",
      "recommended_action": "select_new",
      "reasons": [
        "综合得分达到新增事实准入线",
        "证据声明 1 条，其中直接证据 1 条"
      ],
      "rank": 2
    },
    {
      "candidate_id": "candidate-20260729-005",
      "primary_category": "consumer_ai",
      "novelty_kind": "new_theme",
      "components": {
        "authority": 88,
        "freshness": 94,
        "relevance": 92,
        "evidence_quality": 88,
        "impact": 89,
        "novelty": 88,
        "content_value": 95,
        "product_value": 82,
        "risk_penalty": 0
      },
      "final_score": 90,
      "eligibility": "eligible",
      "recommended_action": "select_new",
      "reasons": [
        "综合得分达到新增事实准入线",
        "证据声明 1 条，其中直接证据 1 条"
      ],
      "rank": 3
    },
    {
      "candidate_id": "candidate-20260729-003",
      "primary_category": "a_share_industry",
      "novelty_kind": "new_theme",
      "components": {
        "authority": 99,
        "freshness": 95,
        "relevance": 91,
        "evidence_quality": 97,
        "impact": 88,
        "novelty": 84,
        "content_value": 90,
        "product_value": 55,
        "risk_penalty": 7
      },
      "final_score": 83,
      "eligibility": "eligible",
      "recommended_action": "select_new",
      "reasons": [
        "综合得分达到新增事实准入线",
        "风险项合计扣减 7 分",
        "证据声明 1 条，其中直接证据 1 条"
      ],
      "rank": 4
    },
    {
      "candidate_id": "candidate-20260729-006",
      "primary_category": "business_strategy",
      "novelty_kind": "continuation",
      "components": {
        "authority": 76,
        "freshness": 92,
        "relevance": 89,
        "evidence_quality": 78,
        "impact": 82,
        "novelty": 72,
        "content_value": 86,
        "product_value": 91,
        "risk_penalty": 0
      },
      "final_score": 82,
      "eligibility": "continuation",
      "recommended_action": "select_continuation",
      "reasons": [
        "具有可证实新增变化，可进入延续跟踪",
        "证据声明 1 条，其中直接证据 0 条"
      ],
      "rank": 5
    },
    {
      "candidate_id": "candidate-20260729-004",
      "primary_category": "product_trend",
      "novelty_kind": "new_theme",
      "components": {
        "authority": 78,
        "freshness": 96,
        "relevance": 90,
        "evidence_quality": 80,
        "impact": 86,
        "novelty": 91,
        "content_value": 94,
        "product_value": 88,
        "risk_penalty": 8
      },
      "final_score": 79,
      "eligibility": "eligible",
      "recommended_action": "select_new",
      "reasons": [
        "综合得分达到新增事实准入线",
        "风险项合计扣减 8 分",
        "证据声明 1 条，其中直接证据 1 条"
      ],
      "rank": 6
    },
    {
      "candidate_id": "candidate-20260729-007",
      "primary_category": "developer_tools",
      "novelty_kind": "repeated",
      "components": {
        "authority": 62,
        "freshness": 90,
        "relevance": 75,
        "evidence_quality": 55,
        "impact": 45,
        "novelty": 15,
        "content_value": 35,
        "product_value": 20,
        "risk_penalty": 8
      },
      "final_score": 45,
      "eligibility": "rejected",
      "recommended_action": "reject_duplicate",
      "reasons": [
        "3 天窗口内存在同一事件",
        "风险项合计扣减 8 分",
        "证据声明 1 条，其中直接证据 1 条"
      ],
      "rank": null
    },
    {
      "candidate_id": "candidate-20260729-008",
      "primary_category": "risk_counter_signal",
      "novelty_kind": "new_theme",
      "components": {
        "authority": 25,
        "freshness": 95,
        "relevance": 70,
        "evidence_quality": 25,
        "impact": 55,
        "novelty": 60,
        "content_value": 65,
        "product_value": 35,
        "risk_penalty": 22
      },
      "final_score": 31,
      "eligibility": "rejected",
      "recommended_action": "reject_low_confidence",
      "reasons": [
        "候选事件初步置信度为低",
        "风险项合计扣减 22 分",
        "证据声明 1 条，其中直接证据 0 条"
      ],
      "rank": null
    }
  ]
}
